{
  "$schema": "https://json-schema.org/draft/2020-12/schema",
  "title": "Cleanup deletion action input v2",
  "type": "object",
  "additionalProperties": false,
  "properties": {
    "schemaVersion": {
      "const": "2.0"
    },
    "policy": {
      "$ref": "cleanup-policy.schema.json"
    },
    "decisionId": {
      "type": "string",
      "pattern": "^[a-f0-9]{64}$"
    },
    "workspaceId": {
      "$ref": "contract-common.schema.json#/$defs/id"
    },
    "creationOperationId": {
      "$ref": "contract-common.schema.json#/$defs/id"
    },
    "receiptDigest": {
      "type": "string",
      "pattern": "^[a-f0-9]{64}$"
    }
  },
  "required": [
    "schemaVersion",
    "policy",
    "decisionId",
    "workspaceId",
    "creationOperationId",
    "receiptDigest"
  ]
}
