{
  "schemaVersion": "2.0",
  "policy": {
    "schemaVersion": "1.0",
    "trigger": "operator_request",
    "actionId": "labstride.workspace-cleanup",
    "actionVersion": "1.1.0",
    "completion": "merge_only",
    "regenerableIgnoredPaths": [
      "node_modules",
      "build/cache"
    ]
  },
  "decisionId": "dddddddddddddddddddddddddddddddddddddddddddddddddddddddddddddddd",
  "workspaceId": "ws-example-001",
  "creationOperationId": "op-example-001",
  "receiptDigest": "5e0c1a1dd2a6e64e3ac8763062e08e70ce2ef717de15d8b945cc57fa6f8eb3f1"
}
